{
  "contract_version": "today_day_v1",
  "core_message": {
    "title": "День на внимательность",
    "text": "Карта и число тянут к одному: не распыляться.",
    "risk": "Перегруз списком задач до обеда.",
    "best_move": "Один шаг до 12:00, без новых обязательств."
  },
  "spheres": [
    {
      "id": "work",
      "title": "Работа",
      "score": 78,
      "status": "strong",
      "why": "Много открытых хвостов.",
      "do": "Закрыть одну задачу целиком.",
      "avoid": "Новые обещания коллегам.",
      "question": "Что реально блокирует фокус?"
    },
    {
      "id": "love",
      "title": "Отношения",
      "score": 45,
      "status": "neutral",
      "why": "Тон чувствительнее обычного.",
      "do": "Сказать прямо, без намёков.",
      "avoid": "Пассивная агрессия.",
      "question": "О чём ты не говоришь вслух?"
    },
    {
      "id": "money",
      "title": "Деньги",
      "score": 22,
      "status": "weak",
      "why": "Импульс на траты выше нормы.",
      "do": "Отложить несрочные покупки.",
      "avoid": "«Успокоительный» шопинг.",
      "question": "Что можно отложить на неделю?"
    }
  ],
  "action_options": [
    {
      "id": "close_task",
      "title": "Закрыть одну задачу",
      "why": "Снимает когнитивный шум.",
      "estimated_minutes": 20,
      "creates": "focus_session"
    },
    {
      "id": "walk_block",
      "title": "10 минут без телефона",
      "why": "Сброс перед второй половиной дня.",
      "estimated_minutes": 10,
      "creates": "focus_session"
    },
    {
      "id": "one_message",
      "title": "Одно честное сообщение",
      "why": "Снимает напряжение в отношениях.",
      "estimated_minutes": 15,
      "creates": "focus_session"
    }
  ],
  "support": {
    "recommended": "practice",
    "title": "Короткая пауза",
    "reason": "День плотный — телу нужен якорь.",
    "cta": "Открыть практику"
  },
  "feedback_questions": [
    {
      "id": "accuracy",
      "question": "Это про тебя?",
      "options": ["да", "частично", "нет"]
    }
  ]
}
